{
  "suite": "suites/local-run-smoke.json",
  "repo": ".",
  "outDir": ".helmbench/matrix-demo",
  "failOnRegression": true,
  "baseline": {
    "name": "native",
    "agent": "demo-baseline",
    "variant": "native"
  },
  "heads": [
    {
      "name": "native-search",
      "agent": "demo-search",
      "variant": "native_search",
      "preset": "claude-code",
      "bin": "scripts/demo-local-agent.sh",
      "dangerouslySkipPermissions": true
    },
    {
      "name": "guided",
      "agent": "demo-guided",
      "variant": "ctxhelm_mcp",
      "ctxhelm": true,
      "ctxhelmBin": "scripts/demo-ctxhelm.sh",
      "pack": true,
      "packBudget": "brief",
      "preset": "claude-code",
      "bin": "scripts/demo-local-agent.sh",
      "dangerouslySkipPermissions": true
    }
  ]
}
